{
  "schema_version": "fact_catalog_v1",
  "domain": "receivable_review",
  "description": "应收账款事实字典最小样例。",
  "fields": [
    {
      "id": "project.region_type",
      "title": "项目区域类型",
      "layer": "base_facts",
      "lifecycle": "formal_decision",
      "type": "enum",
      "enum": ["domestic", "overseas", "unknown"],
      "definition": "项目交付和收款规则所适用的区域类型。",
      "aliases": ["海外项目", "国内项目", "境外项目", "境内项目"],
      "positive_examples": ["印尼海外项目", "美国客户项目"],
      "negative_examples": ["外地项目", "跨省项目"],
      "source_priority": ["contract", "erp", "human_input", "user_text"],
      "unknown_policy": "allow_unknown_and_request_fact",
      "conflict_policy": "ask_human",
      "consumer_rules": ["receivable_region_policy_v1"],
      "owner": "business_owner",
      "version": "v1"
    },
    {
      "id": "project.country",
      "title": "项目国家",
      "layer": "base_facts",
      "lifecycle": "formal_supporting",
      "type": "string",
      "definition": "项目主要交付或客户所在国家。",
      "aliases": ["国家", "客户国家", "项目所在地"],
      "positive_examples": ["Indonesia", "China"],
      "negative_examples": ["华东", "跨境"],
      "source_priority": ["contract", "erp", "human_input", "user_text"],
      "unknown_policy": "allow_unknown",
      "conflict_policy": "prefer_source_priority",
      "consumer_rules": [],
      "owner": "business_owner",
      "version": "v1"
    },
    {
      "id": "receivable.stage",
      "title": "应收账款阶段",
      "layer": "base_facts",
      "lifecycle": "formal_decision",
      "type": "enum",
      "enum": ["not_due", "payment_due", "overdue", "late_collection", "disputed", "unknown"],
      "definition": "应收账款当前所处的业务阶段。",
      "aliases": ["回款阶段", "应收阶段", "收款阶段"],
      "positive_examples": ["已到期未回款", "逾期 42 天"],
      "negative_examples": ["项目阶段", "销售阶段"],
      "source_priority": ["erp", "invoice_system", "human_input", "user_text"],
      "unknown_policy": "allow_unknown_and_request_fact",
      "conflict_policy": "ask_human",
      "consumer_rules": ["receivable_stage_policy_v1"],
      "owner": "finance_owner",
      "version": "v1"
    },
    {
      "id": "receivable.overdue_days",
      "title": "应收逾期天数",
      "layer": "base_facts",
      "lifecycle": "formal_decision",
      "type": "integer",
      "unit": "day",
      "definition": "应收账款从约定付款日到当前日期的逾期自然日数量。",
      "aliases": ["逾期天数", "超期天数", "拖欠天数"],
      "positive_examples": ["逾期 42 天", "超期 3 个月"],
      "negative_examples": ["项目进行了 42 天", "合同周期 42 天"],
      "source_priority": ["erp", "invoice_system", "human_input", "user_text"],
      "unknown_policy": "allow_unknown_and_request_fact",
      "conflict_policy": "prefer_system",
      "consumer_rules": ["receivable_overdue_policy_v1"],
      "owner": "finance_owner",
      "version": "v1"
    },
    {
      "id": "receivable.has_dispute",
      "title": "是否存在争议",
      "layer": "base_facts",
      "lifecycle": "formal_decision",
      "type": "boolean",
      "definition": "客户是否明确提出验收、合同、质量、金额或交付争议。",
      "aliases": ["是否争议", "客户异议", "回款争议"],
      "positive_examples": ["客户说未完成验收", "客户对金额有异议"],
      "negative_examples": ["客户暂时没回复", "客户流程慢"],
      "source_priority": ["email", "crm", "human_input", "user_text"],
      "unknown_policy": "allow_unknown_and_request_fact",
      "conflict_policy": "ask_human",
      "consumer_rules": ["receivable_dispute_policy_v1"],
      "owner": "finance_owner",
      "version": "v1"
    },
    {
      "id": "acceptance.completed_status",
      "title": "验收完成状态",
      "layer": "base_facts",
      "lifecycle": "formal_decision",
      "type": "enum",
      "enum": ["completed", "not_completed", "not_required", "unknown"],
      "definition": "项目是否已满足合同或流程要求的验收完成条件。",
      "aliases": ["验收状态", "是否验收", "验收完成"],
      "positive_examples": ["客户已签署验收单", "客户说还没完成验收"],
      "negative_examples": ["客户看过演示", "内部自测通过"],
      "source_priority": ["contract", "crm", "email", "human_input", "user_text"],
      "unknown_policy": "allow_unknown_and_request_fact",
      "conflict_policy": "ask_human",
      "consumer_rules": ["receivable_acceptance_policy_v1"],
      "owner": "delivery_owner",
      "version": "v1"
    }
  ]
}

